{
  "date": "2022-06-26",
  "sunrise": "05:17",
  "sunset": "22:08",
  "minTemp": 14.5,
  "maxTemp": 20.1,
  "hourly": [
    {
      "time": "3",
      "weatherCode": "RAIN",
      "temp": 16.7,
      "humidity": 93,
      "dewPoint": 15.6,
      "pressure": 1011.4,
      "pressureChange": "",
      "windDirectionCode": "SSW",
      "windSpeed": 4.3,
      "visibility": "---",
      "discomfortIndex": 62
    },
    {
      "time": "6",
      "weatherCode": "CLOUDY",
      "temp": 15.6,
      "humidity": 94,
      "dewPoint": 14.6,
      "pressure": 1012.3,
      "pressureChange": "+0.9",
      "windDirectionCode": "SW",
      "windSpeed": 3.4,
      "visibility": "---",
      "discomfortIndex": 60
    },
    {
      "time": "9",
      "weatherCode": "RAIN",
      "temp": 16.9,
      "humidity": 82,
      "dewPoint": 13.9,
      "pressure": 1014.0,
      "pressureChange": "+1.7",
      "windDirectionCode": "WSW",
      "windSpeed": 4.4,
      "visibility": "---",
      "discomfortIndex": 62
    },
    {
      "time": "12",
      "weatherCode": "RAIN",
      "temp": 18.4,
      "humidity": 74,
      "dewPoint": 13.7,
      "pressure": 1015.3,
      "pressureChange": "+1.3",
      "windDirectionCode": "SSW",
      "windSpeed": 3.6,
      "visibility": "---",
      "discomfortIndex": 64
    },
    {
      "time": "15",
      "weatherCode": "CLOUDY",
      "temp": 20.0,
      "humidity": 63,
      "dewPoint": 12.8,
      "pressure": 1015.7,
      "pressureChange": "+0.4",
      "windDirectionCode": "S",
      "windSpeed": 3.9,
      "visibility": "---",
      "discomfortIndex": 66
    },
    {
      "time": "18",
      "weatherCode": "CLOUDY",
      "temp": 19.0,
      "humidity": 61,
      "dewPoint": 11.4,
      "pressure": 1016.0,
      "pressureChange": "+0.3",
      "windDirectionCode": "S",
      "windSpeed": 4.3,
      "visibility": "---",
      "discomfortIndex": 64
    },
    {
      "time": "21",
      "weatherCode": "CLOUDY",
      "temp": 17.3,
      "humidity": 77,
      "dewPoint": 13.3,
      "pressure": 1015.6,
      "pressureChange": "-0.4",
      "windDirectionCode": "SSW",
      "windSpeed": 1.9,
      "visibility": "---",
      "discomfortIndex": 62
    },
    {
      "time": "24",
      "weatherCode": "CLOUDY",
      "temp": 15.5,
      "humidity": 91,
      "dewPoint": 14.0,
      "pressure": 1016.0,
      "pressureChange": "+0.4",
      "windDirectionCode": "SE",
      "windSpeed": 2.1,
      "visibility": "---",
      "discomfortIndex": 60
    }
  ]
}
