{
  "date": "2022-05-22",
  "sunrise": "06:32",
  "sunset": "20:43",
  "minTemp": 18.9,
  "maxTemp": 28.9,
  "hourly": [
    {
      "time": "3",
      "weatherCode": "CLOUDY",
      "temp": 21.2,
      "humidity": 76,
      "dewPoint": 16.9,
      "pressure": 1020.1,
      "pressureChange": "",
      "windDirectionCode": "S",
      "windSpeed": 1.9,
      "visibility": "---",
      "discomfortIndex": 69
    },
    {
      "time": "6",
      "weatherCode": "RAIN",
      "temp": 19.4,
      "humidity": 99,
      "dewPoint": 19.2,
      "pressure": 1020.9,
      "pressureChange": "+0.8",
      "windDirectionCode": "SSW",
      "windSpeed": 1.7,
      "visibility": "---",
      "discomfortIndex": 67
    },
    {
      "time": "9",
      "weatherCode": "CLOUDY",
      "temp": 22.2,
      "humidity": 85,
      "dewPoint": 19.6,
      "pressure": 1022.2,
      "pressureChange": "+1.3",
      "windDirectionCode": "S",
      "windSpeed": 2.2,
      "visibility": "---",
      "discomfortIndex": 71
    },
    {
      "time": "12",
      "weatherCode": "CLOUDY",
      "temp": 27.4,
      "humidity": 60,
      "dewPoint": 18.9,
      "pressure": 1021.5,
      "pressureChange": "-0.7",
      "windDirectionCode": "W",
      "windSpeed": 2.5,
      "visibility": "---",
      "discomfortIndex": 76
    },
    {
      "time": "15",
      "weatherCode": "CLOUDY",
      "temp": 27.8,
      "humidity": 53,
      "dewPoint": 17.4,
      "pressure": 1019.3,
      "pressureChange": "-2.2",
      "windDirectionCode": "W",
      "windSpeed": 2.0,
      "visibility": "---",
      "discomfortIndex": 76
    },
    {
      "time": "18",
      "weatherCode": "CLOUDY",
      "temp": 26.4,
      "humidity": 63,
      "dewPoint": 18.7,
      "pressure": 1018.9,
      "pressureChange": "-0.4",
      "windDirectionCode": "NNE",
      "windSpeed": 1.4,
      "visibility": "---",
      "discomfortIndex": 75
    },
    {
      "time": "21",
      "weatherCode": "CLOUDY",
      "temp": 21.2,
      "humidity": 82,
      "dewPoint": 18.0,
      "pressure": 1020.6,
      "pressureChange": "+1.7",
      "windDirectionCode": "N",
      "windSpeed": 3.1,
      "visibility": "---",
      "discomfortIndex": 69
    },
    {
      "time": "24",
      "weatherCode": "RAIN",
      "temp": 20.5,
      "humidity": 88,
      "dewPoint": 18.5,
      "pressure": 1021.3,
      "pressureChange": "+0.7",
      "windDirectionCode": "ENE",
      "windSpeed": 2.6,
      "visibility": "---",
      "discomfortIndex": 68
    }
  ]
}
