{
  "date": "2019-07-21",
  "sunrise": "04:30",
  "sunset": "18:57",
  "minTemp": 19.8,
  "maxTemp": 20.6,
  "hourly": [
    {
      "time": "3",
      "weatherCode": "RAIN",
      "temp": 20.1,
      "humidity": 100,
      "dewPoint": 20.1,
      "pressure": 1011.9,
      "pressureChange": "",
      "windDirectionCode": "ESE",
      "windSpeed": 1.6,
      "visibility": 4,
      "discomfortIndex": 68
    },
    {
      "time": "6",
      "weatherCode": "RAIN",
      "temp": 20,
      "humidity": 99,
      "dewPoint": 19.9,
      "pressure": 1012,
      "pressureChange": "+0.1",
      "windDirectionCode": "ESE",
      "windSpeed": 1.7,
      "visibility": 3,
      "discomfortIndex": 68
    },
    {
      "time": "9",
      "weatherCode": "CLOUDY",
      "temp": 20.6,
      "humidity": 91,
      "dewPoint": 19.1,
      "pressure": 1012.1,
      "pressureChange": "+0.1",
      "windDirectionCode": "ESE",
      "windSpeed": 1.7,
      "visibility": 9,
      "discomfortIndex": 69
    },
    {
      "time": "12",
      "weatherCode": "RAIN",
      "temp": 20.3,
      "humidity": 97,
      "dewPoint": 19.8,
      "pressure": 1011.8,
      "pressureChange": "-0.3",
      "windDirectionCode": "SE",
      "windSpeed": 2.5,
      "visibility": 3,
      "discomfortIndex": 68
    },
    {
      "time": "15",
      "weatherCode": "CLOUDY",
      "temp": 20.5,
      "humidity": 91,
      "dewPoint": 19,
      "pressure": 1011.2,
      "pressureChange": "-0.6",
      "windDirectionCode": "SE",
      "windSpeed": 3.4,
      "visibility": 15,
      "discomfortIndex": 68
    },
    {
      "time": "18",
      "weatherCode": "CLOUDY",
      "temp": 20.3,
      "humidity": 91,
      "dewPoint": 18.8,
      "pressure": 1010.9,
      "pressureChange": "-0.3",
      "windDirectionCode": "SE",
      "windSpeed": 2.6,
      "visibility": 15,
      "discomfortIndex": 68
    },
    {
      "time": "21",
      "weatherCode": "CLOUDY",
      "temp": 19.8,
      "humidity": 90,
      "dewPoint": 18.1,
      "pressure": 1011.3,
      "pressureChange": "+0.4",
      "windDirectionCode": "SE",
      "windSpeed": 3,
      "visibility": 20,
      "discomfortIndex": 67
    },
    {
      "time": "24",
      "weatherCode": "UNKNOWN",
      "temp": 19.9,
      "humidity": 92,
      "dewPoint": 18.6,
      "pressure": 1010.5,
      "pressureChange": "-0.8",
      "windDirectionCode": "SE",
      "windSpeed": 1.8,
      "visibility": "---",
      "discomfortIndex": 67
    }
  ]
}
