{
  "date": "2023-12-09",
  "sunrise": "05:44",
  "sunset": "20:31",
  "minTemp": 12.1,
  "maxTemp": 20.3,
  "hourly": [
    {
      "time": "3",
      "weatherCode": "CLOUDY",
      "temp": 13.5,
      "humidity": 86,
      "dewPoint": 11.2,
      "pressure": 1022.7,
      "pressureChange": "",
      "windDirectionCode": "NE",
      "windSpeed": 1.9,
      "visibility": "---",
      "discomfortIndex": 56
    },
    {
      "time": "6",
      "weatherCode": "PARTLY_CLOUDY",
      "temp": 13.1,
      "humidity": 95,
      "dewPoint": 12.3,
      "pressure": 1023.0,
      "pressureChange": "+0.3",
      "windDirectionCode": "N",
      "windSpeed": 1.9,
      "visibility": "---",
      "discomfortIndex": 56
    },
    {
      "time": "9",
      "weatherCode": "PARTLY_CLOUDY",
      "temp": 15.5,
      "humidity": 78,
      "dewPoint": 11.7,
      "pressure": 1024.3,
      "pressureChange": "+1.3",
      "windDirectionCode": "NW",
      "windSpeed": 2.8,
      "visibility": "---",
      "discomfortIndex": 60
    },
    {
      "time": "12",
      "weatherCode": "RAIN",
      "temp": 18.6,
      "humidity": 64,
      "dewPoint": 11.7,
      "pressure": 1023.7,
      "pressureChange": "-0.6",
      "windDirectionCode": "WNW",
      "windSpeed": 4.0,
      "visibility": "---",
      "discomfortIndex": 64
    },
    {
      "time": "15",
      "weatherCode": "CLEAR",
      "temp": 20.3,
      "humidity": 52,
      "dewPoint": 10.1,
      "pressure": 1021.8,
      "pressureChange": "-1.9",
      "windDirectionCode": "WNW",
      "windSpeed": 5.0,
      "visibility": "---",
      "discomfortIndex": 66
    },
    {
      "time": "18",
      "weatherCode": "CLEAR",
      "temp": 19.4,
      "humidity": 54,
      "dewPoint": 9.9,
      "pressure": 1020.8,
      "pressureChange": "-1.0",
      "windDirectionCode": "WNW",
      "windSpeed": 5.1,
      "visibility": "---",
      "discomfortIndex": 65
    },
    {
      "time": "21",
      "weatherCode": "CLEAR",
      "temp": 14.4,
      "humidity": 78,
      "dewPoint": 10.6,
      "pressure": 1021.9,
      "pressureChange": "+1.1",
      "windDirectionCode": "WNW",
      "windSpeed": 2.8,
      "visibility": "---",
      "discomfortIndex": 58
    },
    {
      "time": "24",
      "weatherCode": "CLEAR",
      "temp": 11.3,
      "humidity": 94,
      "dewPoint": 10.3,
      "pressure": 1021.8,
      "pressureChange": "-0.1",
      "windDirectionCode": "NNW",
      "windSpeed": 1.4,
      "visibility": "---",
      "discomfortIndex": 53
    }
  ]
}
