{
  "date": "2024-05-26",
  "sunrise": "05:20",
  "sunset": "21:01",
  "minTemp": 8.4,
  "maxTemp": 12.6,
  "hourly": [
    {
      "time": "3",
      "weatherCode": "RAIN",
      "temp": 9.7,
      "humidity": 83,
      "dewPoint": 7.0,
      "pressure": 1017.4,
      "pressureChange": "",
      "windDirectionCode": "SSW",
      "windSpeed": 3.0,
      "visibility": "---",
      "discomfortIndex": 50
    },
    {
      "time": "6",
      "weatherCode": "RAIN",
      "temp": 9.6,
      "humidity": 94,
      "dewPoint": 8.7,
      "pressure": 1018.2,
      "pressureChange": "+0.8",
      "windDirectionCode": "ESE",
      "windSpeed": 2.8,
      "visibility": "---",
      "discomfortIndex": 50
    },
    {
      "time": "9",
      "weatherCode": "RAIN",
      "temp": 9.8,
      "humidity": 90,
      "dewPoint": 8.3,
      "pressure": 1018.5,
      "pressureChange": "+0.3",
      "windDirectionCode": "SSE",
      "windSpeed": 3.6,
      "visibility": "---",
      "discomfortIndex": 50
    },
    {
      "time": "12",
      "weatherCode": "RAIN",
      "temp": 10.7,
      "humidity": 87,
      "dewPoint": 8.6,
      "pressure": 1018.7,
      "pressureChange": "+0.2",
      "windDirectionCode": "SSE",
      "windSpeed": 1.8,
      "visibility": "---",
      "discomfortIndex": 52
    },
    {
      "time": "15",
      "weatherCode": "CLOUDY",
      "temp": 12.6,
      "humidity": 84,
      "dewPoint": 10.0,
      "pressure": 1019.1,
      "pressureChange": "+0.4",
      "windDirectionCode": "SE",
      "windSpeed": 2.2,
      "visibility": "---",
      "discomfortIndex": 55
    },
    {
      "time": "18",
      "weatherCode": "RAIN",
      "temp": 11.6,
      "humidity": 88,
      "dewPoint": 9.7,
      "pressure": 1019.9,
      "pressureChange": "+0.8",
      "windDirectionCode": "ENE",
      "windSpeed": 1.6,
      "visibility": "---",
      "discomfortIndex": 53
    },
    {
      "time": "21",
      "weatherCode": "PARTLY_CLOUDY",
      "temp": 10.2,
      "humidity": 97,
      "dewPoint": 9.7,
      "pressure": 1019.6,
      "pressureChange": "-0.3",
      "windDirectionCode": "S",
      "windSpeed": 1.3,
      "visibility": "---",
      "discomfortIndex": 50
    },
    {
      "time": "24",
      "weatherCode": "CLOUDY",
      "temp": 8.7,
      "humidity": 96,
      "dewPoint": 8.1,
      "pressure": 1019.5,
      "pressureChange": "-0.1",
      "windDirectionCode": "WNW",
      "windSpeed": 0.4,
      "visibility": "---",
      "discomfortIndex": 48
    }
  ]
}
