{
  "date": "2025-09-21",
  "sunrise": "05:47",
  "sunset": "17:52",
  "minTemp": 6.5,
  "maxTemp": 22.1,
  "hourly": [
    {
      "time": "3",
      "weatherCode": "CLEAR",
      "temp": 8.7,
      "humidity": 68,
      "dewPoint": 3.1,
      "pressure": 1015.2,
      "pressureChange": "",
      "windDirectionCode": "WNW",
      "windSpeed": 0.4,
      "visibility": "---",
      "discomfortIndex": 49
    },
    {
      "time": "6",
      "weatherCode": "CLEAR",
      "temp": 6.5,
      "humidity": 82,
      "dewPoint": 3.6,
      "pressure": 1017.0,
      "pressureChange": "+1.8",
      "windDirectionCode": "NNW",
      "windSpeed": 2.3,
      "visibility": "---",
      "discomfortIndex": 45
    },
    {
      "time": "9",
      "weatherCode": "PARTLY_CLOUDY",
      "temp": 14.4,
      "humidity": 53,
      "dewPoint": 4.9,
      "pressure": 1016.9,
      "pressureChange": "-0.1",
      "windDirectionCode": "N",
      "windSpeed": 2.3,
      "visibility": "---",
      "discomfortIndex": 58
    },
    {
      "time": "12",
      "weatherCode": "PARTLY_CLOUDY",
      "temp": 20.0,
      "humidity": 41,
      "dewPoint": 6.4,
      "pressure": 1015.0,
      "pressureChange": "-1.9",
      "windDirectionCode": "NW",
      "windSpeed": 1.5,
      "visibility": "---",
      "discomfortIndex": 65
    },
    {
      "time": "15",
      "weatherCode": "PARTLY_CLOUDY",
      "temp": 21.9,
      "humidity": 37,
      "dewPoint": 6.7,
      "pressure": 1012.3,
      "pressureChange": "-2.7",
      "windDirectionCode": "SW",
      "windSpeed": 3.5,
      "visibility": "---",
      "discomfortIndex": 67
    },
    {
      "time": "18",
      "weatherCode": "CLEAR",
      "temp": 16.1,
      "humidity": 57,
      "dewPoint": 7.5,
      "pressure": 1014.8,
      "pressureChange": "+2.5",
      "windDirectionCode": "WSW",
      "windSpeed": 2.8,
      "visibility": "---",
      "discomfortIndex": 60
    },
    {
      "time": "21",
      "weatherCode": "CLEAR",
      "temp": 11.3,
      "humidity": 75,
      "dewPoint": 7.1,
      "pressure": 1016.1,
      "pressureChange": "+1.3",
      "windDirectionCode": "SW",
      "windSpeed": 0.7,
      "visibility": "---",
      "discomfortIndex": 53
    },
    {
      "time": "24",
      "weatherCode": "CLEAR",
      "temp": 7.8,
      "humidity": 94,
      "dewPoint": 6.9,
      "pressure": 1016.0,
      "pressureChange": "-0.1",
      "windDirectionCode": "W",
      "windSpeed": 0.8,
      "visibility": "---",
      "discomfortIndex": 46
    }
  ]
}
