{
  "date": "2014-11-02",
  "sunrise": "06:39",
  "sunset": "17:29",
  "minTemp": 15.8,
  "maxTemp": 20.8,
  "hourly": [
    {
      "time": "3",
      "weatherCode": "CLOUDY",
      "temp": 19.1,
      "humidity": 93,
      "dewPoint": 18.0,
      "pressure": 1007.2,
      "pressureChange": "+0.0",
      "windDirectionCode": "W",
      "windSpeed": 1.1,
      "visibility": 20.0,
      "discomfortIndex": 66
    },
    {
      "time": "6",
      "weatherCode": "CLOUDY",
      "temp": 19.9,
      "humidity": 74,
      "dewPoint": 15.1,
      "pressure": 1007.2,
      "pressureChange": "0.0",
      "windDirectionCode": "WNW",
      "windSpeed": 4.1,
      "visibility": 20.0,
      "discomfortIndex": 66
    },
    {
      "time": "9",
      "weatherCode": "CLOUDY",
      "temp": 19.8,
      "humidity": 72,
      "dewPoint": 14.6,
      "pressure": 1008.0,
      "pressureChange": "+0.8",
      "windDirectionCode": "WNW",
      "windSpeed": 5.3,
      "visibility": 20.0,
      "discomfortIndex": 66
    },
    {
      "time": "12",
      "weatherCode": "CLOUDY",
      "temp": 20.8,
      "humidity": 59,
      "dewPoint": 12.5,
      "pressure": 1006.8,
      "pressureChange": "-1.2",
      "windDirectionCode": "WNW",
      "windSpeed": 4.3,
      "visibility": 20.0,
      "discomfortIndex": 67
    },
    {
      "time": "15",
      "weatherCode": "CLOUDY",
      "temp": 17.6,
      "humidity": 75,
      "dewPoint": 13.1,
      "pressure": 1007.1,
      "pressureChange": "+0.3",
      "windDirectionCode": "NW",
      "windSpeed": 5.5,
      "visibility": 20.0,
      "discomfortIndex": 63
    },
    {
      "time": "18",
      "weatherCode": "CLEAR",
      "temp": 17.4,
      "humidity": 55,
      "dewPoint": 8.3,
      "pressure": 1009.0,
      "pressureChange": "+1.9",
      "windDirectionCode": "WNW",
      "windSpeed": 3.6,
      "visibility": 15.0,
      "discomfortIndex": 62
    },
    {
      "time": "21",
      "weatherCode": "CLOUDY",
      "temp": 16.8,
      "humidity": 46,
      "dewPoint": 5.1,
      "pressure": 1010.2,
      "pressureChange": "+1.2",
      "windDirectionCode": "NW",
      "windSpeed": 2.8,
      "visibility": 25.0,
      "discomfortIndex": 61
    },
    {
      "time": "24",
      "weatherCode": "UNKNOWN",
      "temp": 15.8,
      "humidity": 49,
      "dewPoint": 5.1,
      "pressure": 1010.8,
      "pressureChange": "+0.6",
      "windDirectionCode": "NNW",
      "windSpeed": 3.8,
      "visibility": "---",
      "discomfortIndex": 60
    }
  ]
}
