{
  "date": "2023-09-10",
  "sunrise": "05:22",
  "sunset": "18:00",
  "minTemp": 17.7,
  "maxTemp": 26.4,
  "hourly": [
    {
      "time": "3",
      "weatherCode": "CLEAR",
      "temp": 18,
      "humidity": 100,
      "dewPoint": 18,
      "pressure": 916.7,
      "pressureChange": "-0.5",
      "windDirectionCode": "SSW",
      "windSpeed": 0.9,
      "visibility": 11.2,
      "discomfortIndex": 65
    },
    {
      "time": "6",
      "weatherCode": "CLEAR",
      "temp": 17.7,
      "humidity": 100,
      "dewPoint": 17.7,
      "pressure": 917.6,
      "pressureChange": "+0.9",
      "windDirectionCode": "SSW",
      "windSpeed": 1.3,
      "visibility": 18.5,
      "discomfortIndex": 65
    },
    {
      "time": "9",
      "weatherCode": "CLEAR",
      "temp": 24.4,
      "humidity": 77,
      "dewPoint": 20.1,
      "pressure": 917.7,
      "pressureChange": "+0.1",
      "windDirectionCode": "NE",
      "windSpeed": 1.7,
      "visibility": 20,
      "discomfortIndex": 73
    },
    {
      "time": "12",
      "weatherCode": "CLOUDY",
      "temp": 25.6,
      "humidity": 73,
      "dewPoint": 20.4,
      "pressure": 917.2,
      "pressureChange": "-0.5",
      "windDirectionCode": "WNW",
      "windSpeed": 2,
      "visibility": 20,
      "discomfortIndex": 74
    },
    {
      "time": "15",
      "weatherCode": "CLOUDY",
      "temp": 26.4,
      "humidity": 71,
      "dewPoint": 20.7,
      "pressure": 916.6,
      "pressureChange": "-0.6",
      "windDirectionCode": "SSE",
      "windSpeed": 4.3,
      "visibility": 20,
      "discomfortIndex": 75
    },
    {
      "time": "18",
      "weatherCode": "CLOUDY",
      "temp": 23.6,
      "humidity": 84,
      "dewPoint": 20.7,
      "pressure": 917.7,
      "pressureChange": "+1.1",
      "windDirectionCode": "WNW",
      "windSpeed": 2.2,
      "visibility": 20,
      "discomfortIndex": 72
    },
    {
      "time": "21",
      "weatherCode": "CLOUDY",
      "temp": 21.5,
      "humidity": 95,
      "dewPoint": 20.7,
      "pressure": 918.8,
      "pressureChange": "+1.1",
      "windDirectionCode": "NNW",
      "windSpeed": 1.3,
      "visibility": 20,
      "discomfortIndex": 69
    },
    {
      "time": "24",
      "weatherCode": "CLOUDY",
      "temp": 20.2,
      "humidity": 95,
      "dewPoint": 19.4,
      "pressure": 918.6,
      "pressureChange": "-0.2",
      "windDirectionCode": "S",
      "windSpeed": 1,
      "visibility": 10.7,
      "discomfortIndex": 67
    }
  ]
}
