{
  "date": "2012-07-29",
  "sunrise": "05:58",
  "sunset": "21:26",
  "minTemp": 11.9,
  "maxTemp": 25.3,
  "hourly": [
    {
      "time": "3",
      "weatherCode": "CLEAR",
      "temp": 13.1,
      "humidity": 92,
      "dewPoint": 11.9,
      "pressure": 1016.7,
      "pressureChange": "",
      "windDirectionCode": "W",
      "windSpeed": 2.1,
      "visibility": "---",
      "discomfortIndex": 56
    },
    {
      "time": "6",
      "weatherCode": "CLEAR",
      "temp": 11.9,
      "humidity": 94,
      "dewPoint": 11.0,
      "pressure": 1016.7,
      "pressureChange": "+0.0",
      "windDirectionCode": "W",
      "windSpeed": 2.1,
      "visibility": "---",
      "discomfortIndex": 54
    },
    {
      "time": "9",
      "weatherCode": "CLEAR",
      "temp": 18.6,
      "humidity": 71,
      "dewPoint": 13.2,
      "pressure": 1017.1,
      "pressureChange": "+0.4",
      "windDirectionCode": "WSW",
      "windSpeed": 0.9,
      "visibility": "---",
      "discomfortIndex": 64
    },
    {
      "time": "12",
      "weatherCode": "PARTLY_CLOUDY",
      "temp": 23.0,
      "humidity": 45,
      "dewPoint": 10.5,
      "pressure": 1016.3,
      "pressureChange": "-0.8",
      "windDirectionCode": "SSE",
      "windSpeed": 1.7,
      "visibility": "---",
      "discomfortIndex": 69
    },
    {
      "time": "15",
      "weatherCode": "CLEAR",
      "temp": 24.8,
      "humidity": 38,
      "dewPoint": 9.6,
      "pressure": 1014.9,
      "pressureChange": "-1.4",
      "windDirectionCode": "SE",
      "windSpeed": 1.9,
      "visibility": "---",
      "discomfortIndex": 70
    },
    {
      "time": "18",
      "weatherCode": "PARTLY_CLOUDY",
      "temp": 25.0,
      "humidity": 39,
      "dewPoint": 9.9,
      "pressure": 1013.9,
      "pressureChange": "-1.0",
      "windDirectionCode": "SE",
      "windSpeed": 3.1,
      "visibility": "---",
      "discomfortIndex": 71
    },
    {
      "time": "21",
      "weatherCode": "PARTLY_CLOUDY",
      "temp": 21.3,
      "humidity": 55,
      "dewPoint": 11.8,
      "pressure": 1013.4,
      "pressureChange": "-0.5",
      "windDirectionCode": "SE",
      "windSpeed": 2.1,
      "visibility": "---",
      "discomfortIndex": 67
    },
    {
      "time": "24",
      "weatherCode": "CLEAR",
      "temp": 17.2,
      "humidity": 70,
      "dewPoint": 11.7,
      "pressure": 1014.2,
      "pressureChange": "+0.8",
      "windDirectionCode": "SSE",
      "windSpeed": 2.1,
      "visibility": "---",
      "discomfortIndex": 62
    }
  ]
}
