{
  "date": "2022-09-25",
  "sunrise": "05:50",
  "sunset": "17:54",
  "minTemp": 15.7,
  "maxTemp": 27.4,
  "hourly": [
    {
      "time": "3",
      "weatherCode": "CLOUDY",
      "temp": 15.7,
      "humidity": 85,
      "dewPoint": 13.2,
      "pressure": 1010.1,
      "pressureChange": "+0.0",
      "windDirectionCode": "WNW",
      "windSpeed": 2.7,
      "visibility": 20.0,
      "discomfortIndex": 60
    },
    {
      "time": "6",
      "weatherCode": "CLOUDY",
      "temp": 15.9,
      "humidity": 83,
      "dewPoint": 13.0,
      "pressure": 1011.4,
      "pressureChange": "+1.3",
      "windDirectionCode": "NW",
      "windSpeed": 2.2,
      "visibility": 4.7,
      "discomfortIndex": 60
    },
    {
      "time": "9",
      "weatherCode": "CLEAR",
      "temp": 23.0,
      "humidity": 60,
      "dewPoint": 14.8,
      "pressure": 1012.2,
      "pressureChange": "+0.8",
      "windDirectionCode": "NW",
      "windSpeed": 1.1,
      "visibility": 20.0,
      "discomfortIndex": 70
    },
    {
      "time": "12",
      "weatherCode": "CLOUDY",
      "temp": 27.1,
      "humidity": 45,
      "dewPoint": 14.2,
      "pressure": 1010.4,
      "pressureChange": "-1.8",
      "windDirectionCode": "SE",
      "windSpeed": 1.1,
      "visibility": 20.0,
      "discomfortIndex": 74
    },
    {
      "time": "15",
      "weatherCode": "CLEAR",
      "temp": 26.9,
      "humidity": 47,
      "dewPoint": 14.7,
      "pressure": 1009.4,
      "pressureChange": "-1.0",
      "windDirectionCode": "WSW",
      "windSpeed": 2.7,
      "visibility": 20.0,
      "discomfortIndex": 74
    },
    {
      "time": "18",
      "weatherCode": "CLEAR",
      "temp": 23.9,
      "humidity": 55,
      "dewPoint": 14.3,
      "pressure": 1009.6,
      "pressureChange": "+0.2",
      "windDirectionCode": "SW",
      "windSpeed": 1.8,
      "visibility": 20.0,
      "discomfortIndex": 71
    },
    {
      "time": "21",
      "weatherCode": "CLEAR",
      "temp": 20.1,
      "humidity": 77,
      "dewPoint": 16.0,
      "pressure": 1011.2,
      "pressureChange": "+1.6",
      "windDirectionCode": "NW",
      "windSpeed": 1.2,
      "visibility": 20.0,
      "discomfortIndex": 67
    },
    {
      "time": "24",
      "weatherCode": "CLOUDY",
      "temp": 18.7,
      "humidity": 85,
      "dewPoint": 16.1,
      "pressure": 1011.3,
      "pressureChange": "+0.1",
      "windDirectionCode": "NW",
      "windSpeed": 1.7,
      "visibility": 20.0,
      "discomfortIndex": 65
    }
  ]
}
