{
  "date": "2012-10-13",
  "sunrise": "06:17",
  "sunset": "18:01",
  "minTemp": 19.0,
  "maxTemp": 24.6,
  "hourly": [
    {
      "time": "3",
      "weatherCode": "RAIN",
      "temp": 19.2,
      "humidity": 95,
      "dewPoint": 18.4,
      "pressure": 1018.0,
      "pressureChange": "",
      "windDirectionCode": "SW",
      "windSpeed": 1.4,
      "visibility": "---",
      "discomfortIndex": 66
    },
    {
      "time": "6",
      "weatherCode": "RAIN",
      "temp": 19.1,
      "humidity": 96,
      "dewPoint": 18.5,
      "pressure": 1018.2,
      "pressureChange": "+0.2",
      "windDirectionCode": "SSW",
      "windSpeed": 1.1,
      "visibility": "---",
      "discomfortIndex": 66
    },
    {
      "time": "9",
      "weatherCode": "RAIN",
      "temp": 24.1,
      "humidity": 77,
      "dewPoint": 19.8,
      "pressure": 1019.2,
      "pressureChange": "+1.0",
      "windDirectionCode": "WSW",
      "windSpeed": 2.8,
      "visibility": "---",
      "discomfortIndex": 73
    },
    {
      "time": "12",
      "weatherCode": "RAIN",
      "temp": 24.4,
      "humidity": 85,
      "dewPoint": 21.8,
      "pressure": 1019.0,
      "pressureChange": "-0.2",
      "windDirectionCode": "W",
      "windSpeed": 1.5,
      "visibility": "---",
      "discomfortIndex": 74
    },
    {
      "time": "15",
      "weatherCode": "RAIN",
      "temp": 24.5,
      "humidity": 84,
      "dewPoint": 21.7,
      "pressure": 1017.2,
      "pressureChange": "-1.8",
      "windDirectionCode": "SW",
      "windSpeed": 3.0,
      "visibility": "---",
      "discomfortIndex": 75
    },
    {
      "time": "18",
      "weatherCode": "RAIN",
      "temp": 22.9,
      "humidity": 90,
      "dewPoint": 21.2,
      "pressure": 1018.3,
      "pressureChange": "+1.1",
      "windDirectionCode": "SW",
      "windSpeed": 2.7,
      "visibility": "---",
      "discomfortIndex": 72
    },
    {
      "time": "21",
      "weatherCode": "RAIN",
      "temp": 22.1,
      "humidity": 94,
      "dewPoint": 21.1,
      "pressure": 1019.8,
      "pressureChange": "+1.5",
      "windDirectionCode": "SW",
      "windSpeed": 1.9,
      "visibility": "---",
      "discomfortIndex": 71
    },
    {
      "time": "24",
      "weatherCode": "RAIN",
      "temp": 20.9,
      "humidity": 92,
      "dewPoint": 19.6,
      "pressure": 1019.9,
      "pressureChange": "+0.1",
      "windDirectionCode": "SW",
      "windSpeed": 2.0,
      "visibility": "---",
      "discomfortIndex": 69
    }
  ]
}
