{
  "date": "2006-04-09",
  "sunrise": "06:04",
  "sunset": "18:53",
  "minTemp": 10.3,
  "maxTemp": 30.7,
  "hourly": [
    {
      "time": "3",
      "weatherCode": "PARTLY_CLOUDY",
      "temp": 14.6,
      "humidity": 35,
      "dewPoint": -0.6,
      "pressure": 1011.0,
      "pressureChange": "",
      "windDirectionCode": "NNE",
      "windSpeed": 0.8,
      "visibility": "---",
      "discomfortIndex": 58
    },
    {
      "time": "6",
      "weatherCode": "CLEAR",
      "temp": 10.3,
      "humidity": 55,
      "dewPoint": 1.8,
      "pressure": 1011.5,
      "pressureChange": "+0.5",
      "windDirectionCode": "NE",
      "windSpeed": 1.3,
      "visibility": "---",
      "discomfortIndex": 52
    },
    {
      "time": "9",
      "weatherCode": "CLOUDY",
      "temp": 20.9,
      "humidity": 23,
      "dewPoint": -1.1,
      "pressure": 1012.5,
      "pressureChange": "+1.0",
      "windDirectionCode": "E",
      "windSpeed": 1.8,
      "visibility": "---",
      "discomfortIndex": 65
    },
    {
      "time": "12",
      "weatherCode": "PARTLY_CLOUDY",
      "temp": 27.9,
      "humidity": 10,
      "dewPoint": -5.9,
      "pressure": 1011.0,
      "pressureChange": "-1.5",
      "windDirectionCode": "SSW",
      "windSpeed": 0.9,
      "visibility": "---",
      "discomfortIndex": 70
    },
    {
      "time": "15",
      "weatherCode": "PARTLY_CLOUDY",
      "temp": 30.6,
      "humidity": 7,
      "dewPoint": -8.4,
      "pressure": 1008.6,
      "pressureChange": "-2.4",
      "windDirectionCode": "SW",
      "windSpeed": 1.4,
      "visibility": "---",
      "discomfortIndex": 72
    },
    {
      "time": "18",
      "weatherCode": "CLOUDY",
      "temp": 30.1,
      "humidity": 7,
      "dewPoint": -8.8,
      "pressure": 1006.9,
      "pressureChange": "-1.7",
      "windDirectionCode": "SW",
      "windSpeed": 1.6,
      "visibility": "---",
      "discomfortIndex": 72
    },
    {
      "time": "21",
      "weatherCode": "CLOUDY",
      "temp": 25.1,
      "humidity": 12,
      "dewPoint": -6.7,
      "pressure": 1007.1,
      "pressureChange": "+0.2",
      "windDirectionCode": "W",
      "windSpeed": 1.7,
      "visibility": "---",
      "discomfortIndex": 68
    },
    {
      "time": "24",
      "weatherCode": "CLOUDY",
      "temp": 20.2,
      "humidity": 19,
      "dewPoint": -4.4,
      "pressure": 1008.6,
      "pressureChange": "+1.5",
      "windDirectionCode": "SW",
      "windSpeed": 2.8,
      "visibility": "---",
      "discomfortIndex": 64
    }
  ]
}
