{
  "date": "2025-09-28",
  "sunrise": "05:36",
  "sunset": "17:39",
  "minTemp": 20,
  "maxTemp": 25,
  "hourly": [
    {
      "time": "3",
      "weatherCode": "CLEAR",
      "temp": 20.5,
      "humidity": 72,
      "dewPoint": 15.3,
      "pressure": 1016,
      "pressureChange": "+0.2",
      "windDirectionCode": "NE",
      "windSpeed": 3,
      "visibility": 20,
      "discomfortIndex": 67
    },
    {
      "time": "6",
      "weatherCode": "CLEAR",
      "temp": 21,
      "humidity": 70,
      "dewPoint": 15.2,
      "pressure": 1016.2,
      "pressureChange": "+0.2",
      "windDirectionCode": "NE",
      "windSpeed": 4,
      "visibility": 20,
      "discomfortIndex": 68
    },
    {
      "time": "9",
      "weatherCode": "CLEAR",
      "temp": 23,
      "humidity": 65,
      "dewPoint": 15.8,
      "pressure": 1016.5,
      "pressureChange": "+0.3",
      "windDirectionCode": "E",
      "windSpeed": 5,
      "visibility": 20,
      "discomfortIndex": 71
    },
    {
      "time": "12",
      "weatherCode": "CLEAR",
      "temp": 24.5,
      "humidity": 60,
      "dewPoint": 16.2,
      "pressure": 1016,
      "pressureChange": "-0.5",
      "windDirectionCode": "E",
      "windSpeed": 6,
      "visibility": 20,
      "discomfortIndex": 73
    },
    {
      "time": "15",
      "weatherCode": "CLEAR",
      "temp": 25,
      "humidity": 58,
      "dewPoint": 16,
      "pressure": 1015.5,
      "pressureChange": "-0.5",
      "windDirectionCode": "SE",
      "windSpeed": 7,
      "visibility": 20,
      "discomfortIndex": 74
    },
    {
      "time": "18",
      "weatherCode": "CLEAR",
      "temp": 23.5,
      "humidity": 68,
      "dewPoint": 16.8,
      "pressure": 1015.8,
      "pressureChange": "+0.3",
      "windDirectionCode": "E",
      "windSpeed": 5,
      "visibility": 20,
      "discomfortIndex": 72
    },
    {
      "time": "21",
      "weatherCode": "CLEAR",
      "temp": 21.5,
      "humidity": 74,
      "dewPoint": 16.5,
      "pressure": 1016.3,
      "pressureChange": "+0.5",
      "windDirectionCode": "NE",
      "windSpeed": 3,
      "visibility": 20,
      "discomfortIndex": 69
    },
    {
      "time": "24",
      "weatherCode": "UNKNOWN",
      "temp": 20,
      "humidity": 50,
      "dewPoint": 14.5,
      "pressure": 1016.5,
      "pressureChange": "",
      "windDirectionCode": "N",
      "windSpeed": 2.5,
      "visibility": "---",
      "discomfortIndex": "---"
    }
  ]
}
