{
  "date": "2025-09-14",
  "sunrise": "05:16",
  "sunset": "17:49",
  "minTemp": 16.9,
  "maxTemp": 26.7,
  "hourly": [
    {
      "time": "3",
      "weatherCode": "CLOUDY",
      "temp": 22.8,
      "humidity": 81,
      "dewPoint": 19.4,
      "pressure": 993.4,
      "pressureChange": "+2.9",
      "windDirectionCode": "WNW",
      "windSpeed": 7,
      "visibility": 20,
      "discomfortIndex": 71
    },
    {
      "time": "6",
      "weatherCode": "CLOUDY",
      "temp": 21.2,
      "humidity": 77,
      "dewPoint": 17,
      "pressure": 998.4,
      "pressureChange": "+5.0",
      "windDirectionCode": "W",
      "windSpeed": 4,
      "visibility": 20,
      "discomfortIndex": 69
    },
    {
      "time": "9",
      "weatherCode": "CLEAR",
      "temp": 24.4,
      "humidity": 60,
      "dewPoint": 16.2,
      "pressure": 1001.3,
      "pressureChange": "+2.9",
      "windDirectionCode": "NNW",
      "windSpeed": 9,
      "visibility": 20,
      "discomfortIndex": 71
    },
    {
      "time": "12",
      "weatherCode": "CLEAR",
      "temp": 25.9,
      "humidity": 54,
      "dewPoint": 15.9,
      "pressure": 1003.4,
      "pressureChange": "+2.1",
      "windDirectionCode": "NNW",
      "windSpeed": 8,
      "visibility": 20,
      "discomfortIndex": 72
    },
    {
      "time": "15",
      "weatherCode": "CLEAR",
      "temp": 26.1,
      "humidity": 52,
      "dewPoint": 15.5,
      "pressure": 1005,
      "pressureChange": "+1.6",
      "windDirectionCode": "N",
      "windSpeed": 7,
      "visibility": 20,
      "discomfortIndex": 73
    },
    {
      "time": "18",
      "weatherCode": "CLEAR",
      "temp": 23,
      "humidity": 60,
      "dewPoint": 14.8,
      "pressure": 1006.9,
      "pressureChange": "+1.9",
      "windDirectionCode": "NNW",
      "windSpeed": 5,
      "visibility": 20,
      "discomfortIndex": 69
    },
    {
      "time": "21",
      "weatherCode": "CLOUDY",
      "temp": 18.6,
      "humidity": 77,
      "dewPoint": 14.5,
      "pressure": 1008.3,
      "pressureChange": "+1.4",
      "windDirectionCode": "N",
      "windSpeed": 2,
      "visibility": 20,
      "discomfortIndex": 65
    },
    {
      "time": "24",
      "weatherCode": "CLEAR",
      "temp": 16.9,
      "humidity": 83,
      "dewPoint": 14,
      "pressure": 1009.6,
      "pressureChange": "+1.3",
      "windDirectionCode": "N",
      "windSpeed": 1,
      "visibility": 20,
      "discomfortIndex": 63
    }
  ]
}
