{
  "date": "2017-11-19",
  "sunrise": "06:48",
  "sunset": "17:30",
  "minTemp": 15.5,
  "maxTemp": 17.9,
  "hourly": [
    {
      "time": "3",
      "weatherCode": "CLOUDY",
      "temp": 17.0,
      "humidity": 50,
      "dewPoint": 6.5,
      "pressure": 1017.2,
      "pressureChange": "+0.0",
      "windDirectionCode": "NNW",
      "windSpeed": 6.9,
      "visibility": 15.0,
      "discomfortIndex": 61
    },
    {
      "time": "6",
      "weatherCode": "CLOUDY",
      "temp": 17.0,
      "humidity": 49,
      "dewPoint": 6.2,
      "pressure": 1018.7,
      "pressureChange": "+1.5",
      "windDirectionCode": "NNW",
      "windSpeed": 6.4,
      "visibility": 20.0,
      "discomfortIndex": 61
    },
    {
      "time": "9",
      "weatherCode": "CLOUDY",
      "temp": 17.4,
      "humidity": 51,
      "dewPoint": 7.2,
      "pressure": 1020.9,
      "pressureChange": "+2.2",
      "windDirectionCode": "NNW",
      "windSpeed": 6.2,
      "visibility": 20.0,
      "discomfortIndex": 62
    },
    {
      "time": "12",
      "weatherCode": "CLOUDY",
      "temp": 17.7,
      "humidity": 54,
      "dewPoint": 8.3,
      "pressure": 1020.1,
      "pressureChange": "-0.8",
      "windDirectionCode": "N",
      "windSpeed": 5.4,
      "visibility": 15.0,
      "discomfortIndex": 62
    },
    {
      "time": "15",
      "weatherCode": "CLOUDY",
      "temp": 17.2,
      "humidity": 61,
      "dewPoint": 9.6,
      "pressure": 1019.0,
      "pressureChange": "-1.1",
      "windDirectionCode": "N",
      "windSpeed": 4.1,
      "visibility": 20.0,
      "discomfortIndex": 62
    },
    {
      "time": "18",
      "weatherCode": "CLOUDY",
      "temp": 17.1,
      "humidity": 57,
      "dewPoint": 8.5,
      "pressure": 1020.3,
      "pressureChange": "+1.3",
      "windDirectionCode": "NNE",
      "windSpeed": 3.7,
      "visibility": 20.0,
      "discomfortIndex": 62
    },
    {
      "time": "21",
      "weatherCode": "RAIN",
      "temp": 17.1,
      "humidity": 56,
      "dewPoint": 8.3,
      "pressure": 1021.2,
      "pressureChange": "+0.9",
      "windDirectionCode": "N",
      "windSpeed": 3.7,
      "visibility": 20.0,
      "discomfortIndex": 62
    },
    {
      "time": "24",
      "weatherCode": "UNKNOWN",
      "temp": 15.5,
      "humidity": 71,
      "dewPoint": 10.3,
      "pressure": 1020.3,
      "pressureChange": "-0.9",
      "windDirectionCode": "SSE",
      "windSpeed": 1.5,
      "visibility": "---",
      "discomfortIndex": 60
    }
  ]
}
