{
  "date": "2021-11-06",
  "sunrise": "07:01",
  "sunset": "17:51",
  "minTemp": 8.7,
  "maxTemp": 17.1,
  "hourly": [
    {
      "time": "3",
      "weatherCode": "CLEAR",
      "temp": 8.8,
      "humidity": 75,
      "dewPoint": 4.6,
      "pressure": 1019.9,
      "pressureChange": "",
      "windDirectionCode": "NNE",
      "windSpeed": 7.4,
      "visibility": "---",
      "discomfortIndex": 49
    },
    {
      "time": "6",
      "weatherCode": "CLEAR",
      "temp": 8.7,
      "humidity": 72,
      "dewPoint": 3.9,
      "pressure": 1020.0,
      "pressureChange": "+0.1",
      "windDirectionCode": "NNE",
      "windSpeed": 7.3,
      "visibility": "---",
      "discomfortIndex": 49
    },
    {
      "time": "9",
      "weatherCode": "CLEAR",
      "temp": 10.6,
      "humidity": 67,
      "dewPoint": 4.7,
      "pressure": 1020.9,
      "pressureChange": "+0.9",
      "windDirectionCode": "NNE",
      "windSpeed": 7.2,
      "visibility": "---",
      "discomfortIndex": 52
    },
    {
      "time": "12",
      "weatherCode": "CLEAR",
      "temp": 14.6,
      "humidity": 62,
      "dewPoint": 7.3,
      "pressure": 1020.9,
      "pressureChange": "+0.0",
      "windDirectionCode": "NNE",
      "windSpeed": 5.8,
      "visibility": "---",
      "discomfortIndex": 58
    },
    {
      "time": "15",
      "weatherCode": "CLEAR",
      "temp": 17.0,
      "humidity": 52,
      "dewPoint": 7.2,
      "pressure": 1018.6,
      "pressureChange": "-2.3",
      "windDirectionCode": "N",
      "windSpeed": 5.3,
      "visibility": "---",
      "discomfortIndex": 61
    },
    {
      "time": "18",
      "weatherCode": "CLEAR",
      "temp": 14.9,
      "humidity": 61,
      "dewPoint": 7.4,
      "pressure": 1018.9,
      "pressureChange": "+0.3",
      "windDirectionCode": "N",
      "windSpeed": 5.2,
      "visibility": "---",
      "discomfortIndex": 59
    },
    {
      "time": "21",
      "weatherCode": "CLEAR",
      "temp": 12.1,
      "humidity": 66,
      "dewPoint": 5.9,
      "pressure": 1020.3,
      "pressureChange": "+1.4",
      "windDirectionCode": "N",
      "windSpeed": 5.2,
      "visibility": "---",
      "discomfortIndex": 55
    },
    {
      "time": "24",
      "weatherCode": "CLEAR",
      "temp": 10.3,
      "humidity": 71,
      "dewPoint": 5.3,
      "pressure": 1020.7,
      "pressureChange": "+0.4",
      "windDirectionCode": "NNW",
      "windSpeed": 4.6,
      "visibility": "---",
      "discomfortIndex": 52
    }
  ]
}
