{
  "date": "2016-04-10",
  "sunrise": "06:36",
  "sunset": "18:00",
  "minTemp": 18.4,
  "maxTemp": 27.2,
  "hourly": [
    {
      "time": "3",
      "weatherCode": "CLOUDY",
      "temp": 19.0,
      "humidity": 94,
      "dewPoint": 17.9,
      "pressure": 1017.7,
      "pressureChange": "",
      "windDirectionCode": "NNW",
      "windSpeed": 1.4,
      "visibility": "---",
      "discomfortIndex": 66
    },
    {
      "time": "6",
      "weatherCode": "CLOUDY",
      "temp": 18.5,
      "humidity": 95,
      "dewPoint": 17.7,
      "pressure": 1017.6,
      "pressureChange": "-0.1",
      "windDirectionCode": "NNW",
      "windSpeed": 1.8,
      "visibility": "---",
      "discomfortIndex": 65
    },
    {
      "time": "9",
      "weatherCode": "CLOUDY",
      "temp": 21.3,
      "humidity": 77,
      "dewPoint": 17.2,
      "pressure": 1017.4,
      "pressureChange": "-0.2",
      "windDirectionCode": "NNW",
      "windSpeed": 3.1,
      "visibility": "---",
      "discomfortIndex": 69
    },
    {
      "time": "12",
      "weatherCode": "CLOUDY",
      "temp": 27.0,
      "humidity": 51,
      "dewPoint": 16.2,
      "pressure": 1015.9,
      "pressureChange": "-1.5",
      "windDirectionCode": "WNW",
      "windSpeed": 3.8,
      "visibility": "---",
      "discomfortIndex": 75
    },
    {
      "time": "15",
      "weatherCode": "CLOUDY",
      "temp": 24.7,
      "humidity": 68,
      "dewPoint": 18.5,
      "pressure": 1014.4,
      "pressureChange": "-1.5",
      "windDirectionCode": "SSE",
      "windSpeed": 2.2,
      "visibility": "---",
      "discomfortIndex": 73
    },
    {
      "time": "18",
      "weatherCode": "PARTLY_CLOUDY",
      "temp": 22.1,
      "humidity": 80,
      "dewPoint": 18.4,
      "pressure": 1015.1,
      "pressureChange": "+0.7",
      "windDirectionCode": "ESE",
      "windSpeed": 1.8,
      "visibility": "---",
      "discomfortIndex": 70
    },
    {
      "time": "21",
      "weatherCode": "PARTLY_CLOUDY",
      "temp": 21.7,
      "humidity": 79,
      "dewPoint": 17.8,
      "pressure": 1016.0,
      "pressureChange": "+0.9",
      "windDirectionCode": "NNE",
      "windSpeed": 1.2,
      "visibility": "---",
      "discomfortIndex": 70
    },
    {
      "time": "24",
      "weatherCode": "CLEAR",
      "temp": 19.9,
      "humidity": 84,
      "dewPoint": 17.1,
      "pressure": 1015.8,
      "pressureChange": "-0.2",
      "windDirectionCode": "NW",
      "windSpeed": 1.2,
      "visibility": "---",
      "discomfortIndex": 67
    }
  ]
}
